{"iteration": 1, "commit": "cab9a8c", "val_bpb": 0.9955, "memory_gb": 44.0, "status": "keep", "description": "baseline", "log": "results/iter_001/train.log", "patch": "results/iter_001/change.patch"}
{"iteration": 2, "commit": null, "val_bpb": 0.996148, "memory_gb": 44.0, "status": "discard", "description": "Shorten LR warmdown from 50% to 40% of training time.", "log": "results/iter_002/train.log", "patch": "results/iter_002/change.patch"}
{"iteration": 3, "commit": null, "val_bpb": 0.99592, "memory_gb": 44.0, "status": "discard", "description": "Lengthen LR warmdown from 50% to 60% of training time.", "log": "results/iter_003/train.log", "patch": "results/iter_003/change.patch"}
{"iteration": 4, "commit": "2b7260e", "val_bpb": 0.98706, "memory_gb": 43.9, "status": "keep", "description": "Halve total batch size to 262K tokens to double optimizer-update frequency.", "log": "results/iter_004/train.log", "patch": "results/iter_004/change.patch"}
{"iteration": 5, "commit": null, "val_bpb": 0.991041, "memory_gb": 22.2, "status": "discard", "description": "Halve global batch to 131K tokens, using device batch 64 to preserve valid accumulation.", "log": "results/iter_005/train.log", "patch": "results/iter_005/change.patch"}
